id,title,year,venue,status,curation_level,primary_link,arxiv,paper,code,data,huggingface,project,source_role,verification_contract,training_use,one_line_summary,why_it_matters
language-models-do-not-always-say-what-they-think-unfaithful-explanations-in-cha-2023,Language models do not always say what they think: Unfaithful explanations in chain-of-thought prompting,2023,NeurIPS,verified,L4_carded,https://arxiv.org/abs/2305.04388,https://arxiv.org/abs/2305.04388,https://arxiv.org/abs/2305.04388,,,,,audit_failure,mixed,audit;evaluation,This audit shows CoT explanations can rationalize biased answers without revealing the prompt feature that influenced the model.,It prevents treating rationale text as faithful reasoning data unless interventions check whether the trace actually drives the answer.
large-language-models-encode-clinical-knowledge-2023,Large language models encode clinical knowledge,2023,Nature,needs_metadata,L0_seeded,,,,,,,,survey_background,unknown,unknown,Official source is linked; detailed reasoning-data summary is still pending.,"Verified citation waypoint; add a paper-specific data-object, verifier, and audit note before promoting it as a core read."
leandojo-theorem-proving-with-retrieval-augmented-language-models-2023,LeanDojo: Theorem proving with retrieval-augmented language models,2023,NeurIPS Datasets and Benchmarks,verified,L5_audit_ready,https://arxiv.org/abs/2306.15626,https://arxiv.org/abs/2306.15626,https://arxiv.org/abs/2306.15626,https://github.com/lean-dojo/LeanDojo,https://zenodo.org/records/10114157,,https://leandojo.org/,data_release;benchmark;agent_environment,environmental;programmatic,agent_training;sft;evaluation,"LeanDojo releases an open Lean theorem-proving environment, benchmark, and retrieval-augmented prover pipeline.","It turns formal proof work into reusable agent data: repository state, accessible premises, proof states, tactics, retrieval context, and verifier feedback are all part of the record."
legalbench-2023,LegalBench,2023,NeurIPS,verified,L2_artifact_verified,https://arxiv.org/abs/2308.11462,https://arxiv.org/abs/2308.11462,https://arxiv.org/abs/2308.11462,https://github.com/HazyResearch/legalbench,https://github.com/HazyResearch/legalbench,https://huggingface.co/datasets/nguha/legalbench,https://hazyresearch.stanford.edu/legalbench/,benchmark;data_release,judgment_required;mixed,evaluation,LegalBench provides a collaboratively built benchmark suite for legal reasoning tasks across many legal domains.,"It anchors the legal side of judgment-required reasoning data, where task definitions, legal-domain splits, expert validity, and answer rubrics are often more important than a simple verifier."
mammoth-building-math-generalist-models-through-hybrid-instruction-tuning-2023,MAmmoTH: Building math generalist models through hybrid instruction tuning,2023,arXiv,verified,L4_carded,https://arxiv.org/abs/2309.05653,https://arxiv.org/abs/2309.05653,https://arxiv.org/abs/2309.05653,https://github.com/TIGER-AI-Lab/MAmmoTH,https://huggingface.co/datasets/TIGER-Lab/MathInstruct,https://huggingface.co/TIGER-Lab/MAmmoTH-7B,https://tiger-ai-lab.github.io/MAmmoTH/,data_release;construction_recipe;model_report,programmatic;mixed,sft;evaluation,"MAmmoTH releases MathInstruct, a hybrid CoT/PoT math instruction mixture for supervised math reasoning.","It exposes how rationale type, annotation source, tool/program substrate, and subset license all affect reuse of math reasoning data."
maud-a-merger-agreement-understanding-dataset-2023,MAUD: A merger agreement understanding dataset,2023,unknown,needs_metadata,L0_seeded,,,,,,,,survey_background,unknown,unknown,Official source is linked; detailed reasoning-data summary is still pending.,"Verified citation waypoint; add a paper-specific data-object, verifier, and audit note before promoting it as a core read."
measuring-faithfulness-in-chain-of-thought-reasoning-2023,Measuring faithfulness in chain-of-thought reasoning,2023,arXiv,verified,L4_carded,https://arxiv.org/abs/2307.13702,https://arxiv.org/abs/2307.13702,https://arxiv.org/abs/2307.13702,,,,,audit_failure,mixed,audit;evaluation,This paper measures CoT faithfulness by intervening on reasoning text and observing answer changes.,It gives Track 01 a concrete audit lens for separating rationale text as a style target from rationale text as causal reasoning evidence.
metamath-bootstrap-your-own-mathematical-questions-for-large-language-models-2023,MetaMath: Bootstrap your own mathematical questions for large language models,2023,arXiv,verified,L4_carded,https://arxiv.org/abs/2309.12284,https://arxiv.org/abs/2309.12284,https://arxiv.org/abs/2309.12284,https://github.com/meta-math/MetaMath,https://huggingface.co/datasets/meta-math/MetaMathQA,https://huggingface.co/meta-math/MetaMath-7B-V1.0,https://meta-math.github.io/,data_release;construction_recipe;model_report,programmatic;mixed,sft;distillation;evaluation,MetaMath bootstraps math instruction data by rewriting GSM8K and MATH training questions into MetaMathQA.,"It is a math SFT scaling reference whose reuse depends on source split, teacher lineage, near-duplicate, and answer-level verifier audits."
mind2web-towards-a-generalist-agent-for-the-web-2023,Mind2Web: Towards a generalist agent for the web,2023,NeurIPS,needs_metadata,L0_seeded,,,,,,,,survey_background,unknown,unknown,Official source is linked; detailed reasoning-data summary is still pending.,"Verified citation waypoint; add a paper-specific data-object, verifier, and audit note before promoting it as a core read."
orca-progressive-learning-from-complex-explanation-traces-of-gpt-4-2023,Orca: Progressive learning from complex explanation traces of GPT-4,2023,arXiv,verified,L5_audit_ready,https://arxiv.org/abs/2306.02707,https://arxiv.org/abs/2306.02707,https://arxiv.org/abs/2306.02707,,,,https://www.microsoft.com/en-us/research/publication/orca-progressive-learning-from-complex-explanation-traces-of-gpt-4/,construction_recipe;model_report,judgment_required;mixed,sft;distillation;evaluation,Orca studies progressive learning from complex teacher explanation traces rather than shallow imitation of final answers.,It is an early and influential reasoning-distillation recipe: the reusable object is teacher-assisted explanation data plus careful evaluation against style-only imitation.
prm800k-2023,Let's Verify Step by Step,2023,arXiv,verified,L5_audit_ready,https://arxiv.org/abs/2305.20050,https://arxiv.org/abs/2305.20050,https://arxiv.org/abs/2305.20050,,,,,process_supervision;verifier_reward;data_release,judgment_required;programmatic,process_supervision;reward_modeling;evaluation,Provides step-level human labels for mathematical reasoning traces and trains process reward models to identify correct intermediate reasoning.,It is the process-supervision anchor for moving from answer-level math rewards to step-level feedback in reasoning-model training and evaluation.
proofnet-autoformalizing-and-formally-proving-undergraduate-level-mathematics-2023,ProofNet: Autoformalizing and formally proving undergraduate-level mathematics,2023,arXiv preprint,needs_metadata,L0_seeded,,,,,,,,survey_background,unknown,unknown,Official source is linked; detailed reasoning-data summary is still pending.,"Verified citation waypoint; add a paper-specific data-object, verifier, and audit note before promoting it as a core read."
react-synergizing-reasoning-and-acting-in-language-models-2023,ReAct: Synergizing reasoning and acting in language models,2023,ICLR,verified,L5_audit_ready,https://arxiv.org/abs/2210.03629,https://arxiv.org/abs/2210.03629,https://arxiv.org/abs/2210.03629,https://github.com/ysymyth/ReAct,,,https://react-lm.github.io/,agent_environment;construction_recipe,environmental;mixed,agent_training;evaluation;test_time_compute,ReAct interleaves reasoning traces with task-specific actions so models can update plans from external observations.,"It is a foundational agent-data pattern: the training/evaluation record is not just an answer but a trajectory of thought-like notes, actions, observations, and final response."
reflexion-language-agents-with-verbal-reinforcement-learning-2023,Reflexion: Language agents with verbal reinforcement learning,2023,NeurIPS,needs_metadata,L0_seeded,,,,,,,,survey_background,unknown,unknown,Official source is linked; detailed reasoning-data summary is still pending.,"Verified citation waypoint; add a paper-specific data-object, verifier, and audit note before promoting it as a core read."
rest-textsuperscriptem-2023,Beyond Human Data: Scaling Self-Training for Problem-Solving with Language Models,2023,arXiv,verified,L4_carded,https://arxiv.org/abs/2312.06585,https://arxiv.org/abs/2312.06585,https://arxiv.org/abs/2312.06585,,,,,construction_recipe;scaling_study,programmatic,sft,"ReST^EM samples model solutions, filters them with binary feedback, and fine-tunes on accepted examples.","It shows how verifiable task feedback can become synthetic training data beyond human-written examples, while exposing verifier and accepted-sample bias risks."
self-consistency-improves-chain-of-thought-reasoning-in-language-models-2023,Self-consistency improves chain of thought reasoning in language models,2023,ICLR,verified,L5_audit_ready,https://arxiv.org/abs/2203.11171,https://arxiv.org/abs/2203.11171,https://arxiv.org/abs/2203.11171,,,,,scaling_study;survey_background,mixed;programmatic,evaluation;test_time_compute,Self-consistency samples multiple chain-of-thought reasoning paths and chooses the answer that is most consistent across samples.,It is the classic test-time compute baseline for reasoning: performance can improve by spending more samples and marginalizing over traces without changing training data.
self-instruct-aligning-language-models-with-self-generated-instructions-2023,Self-Instruct: Aligning language models with self-generated instructions,2023,ACL,verified,L5_audit_ready,https://arxiv.org/abs/2212.10560,https://arxiv.org/abs/2212.10560,https://arxiv.org/abs/2212.10560,,,,,construction_recipe;data_release,mixed,sft,"Self-Instruct bootstraps instruction-following data by having a model generate instructions, inputs, and outputs, then filtering low-quality or duplicate examples.",It is the canonical self-generated instruction-data recipe that later reasoning datasets adapt for prompt sourcing and synthetic expansion.
self-rag-learning-to-retrieve-generate-and-critique-through-self-reflection-2023,"Self-RAG: Learning to retrieve, generate, and critique through self-reflection",2023,ICLR,verified,L5_audit_ready,https://arxiv.org/abs/2310.11511,https://arxiv.org/abs/2310.11511,https://arxiv.org/abs/2310.11511,https://github.com/akariasai/self-rag,https://huggingface.co/datasets/selfrag/selfrag_train_data,https://huggingface.co/selfrag/selfrag_llama2_7b,https://selfrag.github.io/,construction_recipe;data_release;agent_environment,mixed;judgment_required,sft;evaluation;agent_training;audit,"Self-RAG trains models to decide when to retrieve, generate with evidence, and critique outputs using reflection tokens.","It is a key retrieval-augmented reasoning recipe where the data object includes control tokens, retrieved passages, critiques, and final generations."
selfcodealign-self-alignment-for-code-generation-2023,SelfCodeAlign: Self-alignment for code generation,2023,unknown,needs_metadata,L0_seeded,,,,,,,,survey_background,unknown,unknown,Official source is linked; detailed reasoning-data summary is still pending.,"Verified citation waypoint; add a paper-specific data-object, verifier, and audit note before promoting it as a core read."
swe-bench-can-language-models-resolve-real-world-github-issues-2023,SWE-bench: Can language models resolve real-world GitHub issues?,2023,ICLR,verified,L5_audit_ready,https://arxiv.org/abs/2310.06770,https://arxiv.org/abs/2310.06770,https://arxiv.org/abs/2310.06770,https://github.com/swe-bench/SWE-bench,https://github.com/swe-bench/SWE-bench,,https://www.swebench.com/original.html,benchmark;agent_environment,environmental;programmatic,evaluation;agent_training,SWE-bench turns real GitHub issues into repository-level repair tasks evaluated by applying patches and running tests.,"It is the agent/environment anchor where the reasoning-data object includes repository state, issue text, actions, patches, and test-backed outcomes."
toolformer-language-models-can-teach-themselves-to-use-tools-2023,Toolformer: Language models can teach themselves to use tools,2023,NeurIPS,verified,L5_audit_ready,https://arxiv.org/abs/2302.04761,https://arxiv.org/abs/2302.04761,https://arxiv.org/abs/2302.04761,,,,,construction_recipe;agent_environment,mixed,sft;agent_training;evaluation,Toolformer creates self-supervised tool-use data by inserting API calls only when tool results improve language-model likelihood.,"It is a classic construction recipe for tool-call supervision: models learn when to call tools, what arguments to pass, and how to fold observations back into text."
ultrafeedback-boosting-language-models-with-high-quality-feedback-2023,UltraFeedback: Boosting language models with high-quality feedback,2023,ICML,verified,L5_audit_ready,https://arxiv.org/abs/2310.01377,https://arxiv.org/abs/2310.01377,https://arxiv.org/abs/2310.01377,https://github.com/OpenBMB/UltraFeedback,https://huggingface.co/datasets/openbmb/UltraFeedback,https://huggingface.co/datasets/openbmb/UltraFeedback,,data_release;verifier_reward;construction_recipe,judgment_required,preference_learning;reward_modeling;sft;safety_alignment,UltraFeedback releases large-scale AI feedback with fine-grained ratings and critiques over diverse instruction-response pairs.,"It is a widely reused preference/reward data source, but its value depends on auditing prompt sources, judge model behavior, rubric dimensions, and corrected labels."
webarena-a-realistic-web-environment-for-building-autonomous-agents-2023,WebArena: A realistic web environment for building autonomous agents,2023,ICLR,verified,L4_carded,https://arxiv.org/abs/2307.13854,https://arxiv.org/abs/2307.13854,https://arxiv.org/abs/2307.13854,,,,,benchmark;agent_environment,environmental,evaluation;agent_training,Realistic web tasks where the data object is an agent episode and the verifier is task completion in a live-like browser environment.,Realistic web tasks where the data object is an agent episode and the verifier is task completion in a live-like browser environment.
wizardmath-empowering-mathematical-reasoning-for-large-language-models-via-reinf-2023,WizardMath: Empowering mathematical reasoning for large language models via reinforced evol-instruct,2023,arXiv,verified,L4_carded,https://arxiv.org/abs/2308.09583,https://arxiv.org/abs/2308.09583,https://arxiv.org/abs/2308.09583,https://github.com/nlpxucan/WizardLM,,https://huggingface.co/WizardLMTeam/WizardMath-7B-V1.1,https://wizardlm.github.io/,construction_recipe;model_report,programmatic;mixed,sft;distillation;evaluation,"WizardMath adapts Evol-Instruct to math reasoning, but the full training data is not publicly released.",It is useful as a recipe card precisely because it separates an influential construction method from a fully auditable data release.
ai-models-collapse-when-trained-on-recursively-generated-data-2024,AI models collapse when trained on recursively generated data,2024,Nature,needs_metadata,L0_seeded,,,,,,,,survey_background,unknown,unknown,Official source is linked; detailed reasoning-data summary is still pending.,"Verified citation waypoint; add a paper-specific data-object, verifier, and audit note before promoting it as a core read."
apigen-automated-pipeline-for-generating-verifiable-and-diverse-function-calling-2024,APIGen: Automated pipeline for generating verifiable and diverse function-calling datasets,2024,NeurIPS,needs_metadata,L0_seeded,,,,,,,,survey_background,unknown,unknown,Official source is linked; detailed reasoning-data summary is still pending.,"Verified citation waypoint; add a paper-specific data-object, verifier, and audit note before promoting it as a core read."
appworld-a-controllable-world-of-apps-and-people-for-benchmarking-interactive-co-2024,AppWorld: A controllable world of apps and people for benchmarking interactive coding agents,2024,arXiv,verified,L4_carded,https://arxiv.org/abs/2407.18901,https://arxiv.org/abs/2407.18901,https://arxiv.org/abs/2407.18901,,,,,benchmark;agent_environment,environmental;programmatic,evaluation;agent_training,Controllable app world for interactive agents where tool/API state and final task success form the feedback contract.,Controllable app world for interactive agents where tool/API state and final task success form the feedback contract.
bfcl-v3-2024,BFCL v3,2024,unknown,needs_metadata,L0_seeded,,,,,,,,survey_background,unknown,unknown,Official source is linked; detailed reasoning-data summary is still pending.,"Verified citation waypoint; add a paper-specific data-object, verifier, and audit note before promoting it as a core read."
bigcodebench-benchmarking-code-generation-with-diverse-function-calls-and-comple-2024,BigCodeBench: Benchmarking code generation with diverse function calls and complex instructions,2024,ICLR,needs_metadata,L0_seeded,,,,,,,,survey_background,unknown,unknown,Official source is linked; detailed reasoning-data summary is still pending.,"Verified citation waypoint; add a paper-specific data-object, verifier, and audit note before promoting it as a core read."
bright-a-realistic-and-challenging-benchmark-for-reasoning-intensive-retrieval-2024,BRIGHT: A realistic and challenging benchmark for reasoning-intensive retrieval,2024,arXiv preprint,needs_metadata,L0_seeded,,,,,,,,survey_background,unknown,unknown,Official source is linked; detailed reasoning-data summary is still pending.,"Verified citation waypoint; add a paper-specific data-object, verifier, and audit note before promoting it as a core read."
browsergym-a-gym-environment-for-web-agents-2024,BrowserGym: A gym environment for web agents,2024,arXiv,verified,L4_carded,https://arxiv.org/abs/2412.05467,https://arxiv.org/abs/2412.05467,https://arxiv.org/abs/2412.05467,,,,,infrastructure;agent_environment;benchmark,environmental,evaluation;agent_training,A web-agent substrate: useful less as a static dataset and more as a repeatable environment for trajectory collection and evaluation.,A web-agent substrate: useful less as a static dataset and more as a repeatable environment for trajectory collection and evaluation.
chembench-a-benchmark-for-evaluating-large-language-models-in-chemistry-2024,ChemBench: A benchmark for evaluating large language models in chemistry,2024,arXiv preprint,needs_metadata,L0_seeded,,,,,,,,survey_background,unknown,unknown,Official source is linked; detailed reasoning-data summary is still pending.,"Verified citation waypoint; add a paper-specific data-object, verifier, and audit note before promoting it as a core read."
deepseek-prover-advancing-theorem-proving-in-llms-2024,DeepSeek-Prover: Advancing theorem proving in LLMs,2024,arXiv,verified,L5_audit_ready,https://arxiv.org/abs/2405.14333,https://arxiv.org/abs/2405.14333,https://arxiv.org/abs/2405.14333,,https://huggingface.co/datasets/deepseek-ai/DeepSeek-Prover-V1,https://huggingface.co/deepseek-ai/DeepSeek-Prover-V1,https://huggingface.co/deepseek-ai/DeepSeek-Prover-V1,data_release;construction_recipe;model_report,programmatic;environmental,sft;agent_training;evaluation,DeepSeek-Prover generates large-scale Lean 4 theorem-proving data from informal math problems and trains a formal proof model.,"It is a key formal-reasoning data recipe where synthetic formal statements, generated proofs, and Lean verification form a reusable post-training object."
deepseek-prover-v1-5-harnessing-proof-assistant-feedback-for-reinforcement-learn-2024,DeepSeek-Prover-V1.5: Harnessing proof assistant feedback for reinforcement learning and Monte-Carlo tree search,2024,arXiv,verified,L5_audit_ready,https://arxiv.org/abs/2408.08152,https://arxiv.org/abs/2408.08152,https://arxiv.org/abs/2408.08152,https://github.com/deepseek-ai/DeepSeek-Prover-V1.5,,https://huggingface.co/deepseek-ai/DeepSeek-Prover-V1.5-RL,https://github.com/deepseek-ai/DeepSeek-Prover-V1.5,construction_recipe;model_report;scaling_study,programmatic;environmental,rlvr;agent_training;evaluation;test_time_compute,"DeepSeek-Prover-V1.5 adds proof-assistant feedback, RL, and RMaxTS search on top of DeepSeek-Prover-style formal proof data.",It shows how proof-assistant feedback can become both a reward signal and a search guide for formal mathematical reasoning.
deepseekmath-pushing-the-limits-of-mathematical-reasoning-in-open-language-model-2024,DeepSeekMath: Pushing the limits of mathematical reasoning in open language models,2024,arXiv,verified,L5_audit_ready,https://arxiv.org/abs/2402.03300,https://arxiv.org/abs/2402.03300,https://arxiv.org/abs/2402.03300,https://github.com/deepseek-ai/deepseek-math,,https://huggingface.co/collections/deepseek-ai/deepseek-math,https://github.com/deepseek-ai/deepseek-math,model_report;construction_recipe;scaling_study,programmatic;mixed,sft;rlvr;evaluation;test_time_compute,"DeepSeekMath combines math-focused web-data selection with SFT, GRPO-style RL, and self-consistency evaluation for open mathematical reasoning.",It is an important bridge from data selection to RLVR: performance gains are attributed to both a math pretraining corpus and a more memory-efficient policy-optimization recipe.
does-writing-with-lms-reduce-content-diversity-2024,Does writing with LMs reduce content diversity?,2024,unknown,needs_metadata,L0_seeded,,,,,,,,survey_background,unknown,unknown,Official source is linked; detailed reasoning-data summary is still pending.,"Verified citation waypoint; add a paper-specific data-object, verifier, and audit note before promoting it as a core read."
frontiermath-a-benchmark-for-evaluating-advanced-mathematical-reasoning-in-ai-2024,FrontierMath: A benchmark for evaluating advanced mathematical reasoning in AI,2024,arXiv preprint,needs_metadata,L0_seeded,,,,,,,,survey_background,unknown,unknown,Official source is linked; detailed reasoning-data summary is still pending.,"Verified citation waypoint; add a paper-specific data-object, verifier, and audit note before promoting it as a core read."
goedel-prover-a-frontier-model-for-open-source-automated-theorem-proving-2024,Goedel-Prover: A frontier model for open-source automated theorem proving,2024,unknown,needs_metadata,L0_seeded,,,,,,,,survey_background,unknown,unknown,Official source is linked; detailed reasoning-data summary is still pending.,"Verified citation waypoint; add a paper-specific data-object, verifier, and audit note before promoting it as a core read."
gsm-symbolic-2024,GSM-Symbolic,2024,arXiv preprint,needs_metadata,L0_seeded,,,,,,,,survey_background,unknown,unknown,Official source is linked; detailed reasoning-data summary is still pending.,"Verified citation waypoint; add a paper-specific data-object, verifier, and audit note before promoting it as a core read."
harmbench-2024,HarmBench,2024,ICML,needs_metadata,L0_seeded,,,,,,,,survey_background,unknown,unknown,Official source is linked; detailed reasoning-data summary is still pending.,"Verified citation waypoint; add a paper-specific data-object, verifier, and audit note before promoting it as a core read."
helpsteer2-open-source-preference-data-for-helpfulness-and-safety-2024,HelpSteer2: Open-source preference data for helpfulness and safety,2024,arXiv preprint,needs_metadata,L0_seeded,,,,,,,,survey_background,unknown,unknown,Official source is linked; detailed reasoning-data summary is still pending.,"Verified citation waypoint; add a paper-specific data-object, verifier, and audit note before promoting it as a core read."
introducing-swe-bench-verified-2024,Introducing SWE-bench Verified,2024,OpenAI / SWE-bench report,verified,L5_audit_ready,https://openai.com/index/introducing-swe-bench-verified/,,https://openai.com/index/introducing-swe-bench-verified/,https://github.com/swe-bench/SWE-bench,https://huggingface.co/datasets/princeton-nlp/SWE-bench_Verified,https://huggingface.co/datasets/princeton-nlp/SWE-bench_Verified,https://www.swebench.com/verified.html,benchmark;agent_environment;audit_failure,environmental;programmatic,evaluation;agent_training;audit,"SWE-bench Verified is a human-filtered 500-instance subset of SWE-bench designed to reduce ambiguous, unsolvable, or incorrectly tested software-engineering tasks.","It is now a central coding-agent evaluation surface because the data object contains issue text, repository state, proposed patch, and test-backed success criteria."
is-model-collapse-inevitable-2024,Is model collapse inevitable?,2024,arXiv preprint,needs_metadata,L0_seeded,,,,,,,,survey_background,unknown,unknown,Official source is linked; detailed reasoning-data summary is still pending.,"Verified citation waypoint; add a paper-specific data-object, verifier, and audit note before promoting it as a core read."
lab-bench-measuring-capabilities-of-language-models-for-biology-research-2024,LAB-Bench: Measuring capabilities of language models for biology research,2024,unknown,needs_metadata,L0_seeded,,,,,,,,survey_background,unknown,unknown,Official source is linked; detailed reasoning-data summary is still pending.,"Verified citation waypoint; add a paper-specific data-object, verifier, and audit note before promoting it as a core read."
large-language-monkeys-scaling-inference-compute-with-repeated-sampling-2024,Large Language Monkeys: Scaling Inference Compute with Repeated Sampling,2024,arXiv preprint arXiv:2407.21787,verified,L1_link_verified,https://arxiv.org/abs/2407.21787,https://arxiv.org/abs/2407.21787,https://arxiv.org/abs/2407.21787,,,,,survey_background,unknown,unknown,Official source is linked; detailed reasoning-data summary is still pending.,"Verified citation waypoint; add a paper-specific data-object, verifier, and audit note before promoting it as a core read."
