id,title,year,venue,status,curation_level,primary_link,arxiv,paper,code,data,huggingface,project,source_role,verification_contract,training_use,one_line_summary,why_it_matters
learning-to-reason-with-llms-2024,Learning to reason with LLMs,2024,unknown,needs_metadata,L0_seeded,,,,,,,,survey_background,unknown,unknown,Official source is linked; detailed reasoning-data summary is still pending.,"Verified citation waypoint; add a paper-specific data-object, verifier, and audit note before promoting it as a core read."
livebench-a-challenging-contamination-free-benchmark-for-large-language-models-2024,"LiveBench: A challenging, contamination-free benchmark for large language models",2024,arXiv,verified,L5_audit_ready,https://arxiv.org/abs/2406.19314,https://arxiv.org/abs/2406.19314,https://arxiv.org/abs/2406.19314,,,,https://livebench.ai/,benchmark;audit_failure,programmatic;mixed,evaluation;audit,"LiveBench is a frequently updated, contamination-limited benchmark that uses recent sources and objective scoring across math, code, reasoning, language, instruction following, and data analysis.",It gives reasoning-data readers a benchmark-refresh pattern for separating real progress from memorized or stale evaluation items.
livecodebench-holistic-and-contamination-free-evaluation-of-large-language-model-2024,LiveCodeBench: Holistic and contamination-free evaluation of large language models for code,2024,arXiv,verified,L5_audit_ready,https://arxiv.org/abs/2403.07974,https://arxiv.org/abs/2403.07974,https://arxiv.org/abs/2403.07974,https://github.com/livecodebench/livecodebench,https://github.com/livecodebench/livecodebench,,https://livecodebench.github.io/,benchmark;audit_failure,programmatic,evaluation;audit;test_time_compute,"LiveCodeBench continuously collects recent programming problems to evaluate code generation, execution, repair, and test-output prediction under lower contamination risk.","It gives code-reasoning evaluation a moving-time-window design, making it harder to confuse memorized public problems with genuine coding capability."
magicoder-empowering-code-generation-with-oss-instruct-2024,Magicoder: Empowering code generation with OSS-instruct,2024,ICML,verified,L5_audit_ready,https://arxiv.org/abs/2312.02120,https://arxiv.org/abs/2312.02120,https://arxiv.org/abs/2312.02120,https://github.com/ise-uiuc/magicoder,https://huggingface.co/datasets/ise-uiuc/Magicoder-OSS-Instruct-75K,https://huggingface.co/ise-uiuc/Magicoder-S-DS-6.7B,,construction_recipe;data_release;model_report,programmatic;mixed,sft;evaluation;distillation,"Magicoder introduces OSS-Instruct, a code-data recipe that uses open-source code snippets to generate more realistic instruction data.",It is a strong code-data construction example because it grounds synthetic coding instructions in real open-source references rather than free-floating prompt invention.
mammoth2-scaling-instructions-from-the-web-2024,MAmmoTH2: Scaling Instructions from the Web,2024,NeurIPS,verified,L4_carded,https://arxiv.org/abs/2405.03548,https://arxiv.org/abs/2405.03548,https://arxiv.org/abs/2405.03548,https://github.com/TIGER-AI-Lab/MAmmoTH2,https://huggingface.co/datasets/TIGER-Lab/WebInstructFull,https://huggingface.co/TIGER-Lab/MAmmoTH2-8x7B,https://tiger-ai-lab.github.io/MAmmoTH2/,data_release;construction_recipe;scaling_study;model_report,mixed;programmatic,sft;evaluation,"MAmmoTH2 builds WebInstruct by recalling web documents, extracting Q-A pairs, refining them, and training reasoning models.","It is a major web-scale instruction-data reference with provenance, license, benchmark-filtering, and teacher-refinement risks."
math-shepherd-2024,Math-Shepherd,2024,arXiv,verified,L4_carded,https://arxiv.org/abs/2312.08935,https://arxiv.org/abs/2312.08935,https://arxiv.org/abs/2312.08935,,,,,process_supervision;verifier_reward,programmatic,process_supervision;reward_modeling,Rollout-value supervision method that assigns process rewards to intermediate math reasoning steps.,It is the clearest bridge between final-answer verifiers and step-level PRM data: the label is not a human judgment but a rollout-derived estimate of whether a partial step can still reach the right answer.
opencodeinterpreter-integrating-code-generation-with-execution-and-refinement-2024,OpenCodeInterpreter: Integrating code generation with execution and refinement,2024,arXiv preprint,needs_metadata,L0_seeded,,,,,,,,survey_background,unknown,unknown,Official source is linked; detailed reasoning-data summary is still pending.,"Verified citation waypoint; add a paper-specific data-object, verifier, and audit note before promoting it as a core read."
openmathinstruct-2-accelerating-ai-for-math-with-massive-open-source-instruction-2024,OpenMathInstruct-2: Accelerating AI for math with massive open-source instruction data,2024,ICLR,verified,L5_audit_ready,https://arxiv.org/abs/2410.01560,https://arxiv.org/abs/2410.01560,https://arxiv.org/abs/2410.01560,https://github.com/NVIDIA-NeMo/Skills,https://huggingface.co/datasets/nvidia/OpenMathInstruct-2,https://huggingface.co/datasets/nvidia/OpenMathInstruct-2,https://nvidia-nemo.github.io/Skills/releases/openmathinstruct2/,data_release;construction_recipe;scaling_study,programmatic;mixed,sft;distillation;evaluation,OpenMathInstruct-2 releases 14M math instruction-tuning problem-solution pairs generated with an open synthesis pipeline.,"It is a major open math-data release for studying teacher strength, solution format, question diversity, and SFT scaling in reasoning models."
osworld-benchmarking-multimodal-agents-for-open-ended-tasks-in-real-computer-env-2024,OSWorld: Benchmarking multimodal agents for open-ended tasks in real computer environments,2024,NeurIPS,verified,L4_carded,https://arxiv.org/abs/2404.07972,https://arxiv.org/abs/2404.07972,https://arxiv.org/abs/2404.07972,,,,,benchmark;agent_environment,environmental,evaluation;agent_training,"Open-ended computer-use benchmark that makes environment state, UI actions, and terminal outcomes central to reasoning-data evaluation.","Open-ended computer-use benchmark that makes environment state, UI actions, and terminal outcomes central to reasoning-data evaluation."
overoptimization-in-direct-alignment-algorithms-2024,Overoptimization in direct alignment algorithms,2024,unknown,needs_metadata,L0_seeded,,,,,,,,survey_background,unknown,unknown,Official source is linked; detailed reasoning-data summary is still pending.,"Verified citation waypoint; add a paper-specific data-object, verifier, and audit note before promoting it as a core read."
paperqa2-language-agents-achieve-superhuman-synthesis-of-scientific-knowledge-2024,PaperQA2 / Language agents achieve superhuman synthesis of scientific knowledge,2024,arXiv preprint,needs_metadata,L0_seeded,,,,,,,,survey_background,unknown,unknown,Official source is linked; detailed reasoning-data summary is still pending.,"Verified citation waypoint; add a paper-specific data-object, verifier, and audit note before promoting it as a core read."
prometheus-2-an-open-source-language-model-specialized-in-evaluating-other-langu-2024,Prometheus 2: An open source language model specialized in evaluating other language models,2024,EMNLP,verified,L5_audit_ready,https://arxiv.org/abs/2405.01535,https://arxiv.org/abs/2405.01535,https://arxiv.org/abs/2405.01535,https://github.com/prometheus-eval/prometheus-eval,https://aclanthology.org/2024.emnlp-main.248.data.zip,https://huggingface.co/prometheus-eval/prometheus-7b-v2.0,,verifier_reward;model_report;data_release,judgment_required,reward_modeling;preference_learning;evaluation;audit,Prometheus 2 is an open evaluator model for both direct assessment and pairwise ranking under user-defined criteria.,It gives the atlas a concrete open-source judge model whose training/evaluation data can be audited instead of treating proprietary judges as black boxes.
qwen2-5-math-technical-report-toward-mathematical-expert-model-via-self-improvem-2024,Qwen2.5-Math technical report: Toward mathematical expert model via self-improvement,2024,arXiv,verified,L5_audit_ready,https://arxiv.org/abs/2409.12122,https://arxiv.org/abs/2409.12122,https://arxiv.org/abs/2409.12122,https://github.com/QwenLM/Qwen2.5-Math,,https://huggingface.co/Qwen/Qwen2.5-Math-7B,https://qwenlm.github.io/blog/qwen2.5-math/,model_report;construction_recipe;verifier_reward,programmatic;mixed,sft;reward_modeling;rlvr;evaluation;test_time_compute,"Qwen2.5-Math reports a math-specialized model family supporting chain-style and tool-integrated reasoning with base, instruct, and reward-model variants.","It is a useful model-report case where math post-training data, reward models, tool-integrated reasoning, and multilingual math evaluation are tied together."
r-tuning-2024,R-Tuning: Instructing Large Language Models to Say 'I Don't Know',2024,NAACL,verified,L4_carded,https://arxiv.org/abs/2311.09677,https://arxiv.org/abs/2311.09677,https://arxiv.org/abs/2311.09677,https://github.com/shizhediao/R-Tuning,https://drive.google.com/drive/folders/17v7IbnAPXX1NQpqjlDMhhxFK0cuNYSd6?usp=sharing,,,construction_recipe;data_release,judgment_required;mixed,sft;safety_alignment;evaluation,R-Tuning turns abstention into instruction data by teaching models to answer known questions and refuse unknown ones.,It broadens Track 01 beyond producing answers: the target behavior can be calibrated refusal with its own labels and audit context.
raft-adapting-language-model-to-domain-specific-rag-2024,RAFT: Adapting language model to domain-specific RAG,2024,arXiv preprint,needs_metadata,L0_seeded,,,,,,,,survey_background,unknown,unknown,Official source is linked; detailed reasoning-data summary is still pending.,"Verified citation waypoint; add a paper-specific data-object, verifier, and audit note before promoting it as a core read."
rest-mcts-2024,ReST-MCTS*,2024,arXiv,verified,L1_link_verified,https://arxiv.org/abs/2406.03816,https://arxiv.org/abs/2406.03816,https://arxiv.org/abs/2406.03816,,,,,process_supervision;construction_recipe;scaling_study,programmatic;mixed,process_supervision;reward_modeling;test_time_compute,Process-reward-guided tree search recipe for self-training reasoning traces.,"It shows how a process reward can guide search-generated trajectories, so readers can separate data generation, verifier choice, and inference-budget effects."
rewardbench-evaluating-reward-models-for-language-modeling-2024,RewardBench: Evaluating Reward Models for Language Modeling,2024,NeurIPS,verified,L5_audit_ready,https://arxiv.org/abs/2403.13787,https://arxiv.org/abs/2403.13787,https://arxiv.org/abs/2403.13787,,,,,benchmark;verifier_reward,judgment_required;mixed,evaluation;reward_modeling;preference_learning,"RewardBench evaluates reward models on prompt/chosen/rejected trios spanning chat, reasoning, and safety, including structured preference failures.","It helps readers test whether a reward signal generalizes beyond helpfulness style into subtle factual, reasoning, refusal, and safety preferences."
rewarding-progress-scaling-automated-process-verifiers-for-llm-reasoning-2024,Rewarding progress: Scaling automated process verifiers for LLM reasoning,2024,ICLR,verified,L5_audit_ready,https://arxiv.org/abs/2410.08146,https://arxiv.org/abs/2410.08146,https://arxiv.org/abs/2410.08146,,,,,verifier_reward;process_supervision;scaling_study,programmatic;mixed,process_supervision;reward_modeling;rlvr;test_time_compute,Rewarding Progress proposes Process Advantage Verifiers that score whether a reasoning step increases future correctness probability.,It gives process supervision a concrete target beyond dense labels: measure progress under a prover policy and use that signal for search or RL.
scicode-a-benchmark-for-scientific-code-generation-and-reasoning-2024,SciCode: A benchmark for scientific code generation and reasoning,2024,NeurIPS Datasets and Benchmarks,verified,L5_audit_ready,https://arxiv.org/abs/2407.13168,https://arxiv.org/abs/2407.13168,https://arxiv.org/abs/2407.13168,https://github.com/scicode-bench/SciCode,,,https://scicode-bench.github.io/,benchmark;data_release,programmatic;judgment_required,evaluation;audit;test_time_compute,SciCode evaluates code generation for realistic scientific research problems decomposed into subproblems with tests and gold solutions.,"It is a high-quality scientific-code benchmark where the data object links domain context, subproblem decomposition, code synthesis, and executable tests."
self-rewarding-lms-2024,Self-Rewarding Language Models,2024,ICML,verified,L4_carded,https://arxiv.org/abs/2401.10020,https://arxiv.org/abs/2401.10020,https://arxiv.org/abs/2401.10020,,,,,construction_recipe;verifier_reward,judgment_required,preference_learning,Self-Rewarding Language Models use model-generated judgments as preference signals for iterative DPO.,It makes self-generated judge feedback a first-class post-training data object with clear risks around judge bias and reward hacking.
spin-self-play-fine-tuning-converts-weak-language-models-to-strong-language-mode-2024,SPIN: Self-play fine-tuning converts weak language models to strong language models,2024,ICML,verified,L4_carded,https://arxiv.org/abs/2401.01335,https://arxiv.org/abs/2401.01335,https://arxiv.org/abs/2401.01335,https://github.com/uclaml/SPIN,https://huggingface.co/datasets/UCLA-AGI/SPIN_iter0,https://huggingface.co/UCLA-AGI/zephyr-7b-sft-full-SPIN-iter0,https://uclaml.github.io/SPIN/,construction_recipe,judgment_required,sft;preference_learning,SPIN pairs real SFT responses with model-generated responses and iteratively fine-tunes through a self-play objective.,It is a compact example of demonstration-anchored self-play where the model's own responses become contrastive training records.
swe-gym-advancing-software-engineering-agents-with-training-and-evaluation-envir-2024,SWE-Gym: Advancing software engineering agents with training and evaluation environments,2024,arXiv preprint,needs_metadata,L0_seeded,,,,,,,,survey_background,unknown,unknown,Official source is linked; detailed reasoning-data summary is still pending.,"Verified citation waypoint; add a paper-specific data-object, verifier, and audit note before promoting it as a core read."
swe-search-2024,SWE-Search,2024,arXiv preprint,needs_metadata,L0_seeded,,,,,,,,survey_background,unknown,unknown,Official source is linked; detailed reasoning-data summary is still pending.,"Verified citation waypoint; add a paper-specific data-object, verifier, and audit note before promoting it as a core read."
tau-bench-a-benchmark-for-tool-agent-user-interaction-in-real-world-domains-2024,tau-bench: A benchmark for tool-agent-user interaction in real-world domains,2024,arXiv preprint,needs_metadata,L0_seeded,,,,,,,,survey_background,unknown,unknown,Official source is linked; detailed reasoning-data summary is still pending.,"Verified citation waypoint; add a paper-specific data-object, verifier, and audit note before promoting it as a core read."
the-llama-3-herd-of-models-2024,The Llama 3 Herd of models,2024,arXiv preprint,needs_metadata,L0_seeded,,,,,,,,survey_background,unknown,unknown,Official source is linked; detailed reasoning-data summary is still pending.,"Verified citation waypoint; add a paper-specific data-object, verifier, and audit note before promoting it as a core read."
toolace-winning-the-points-of-llm-function-calling-2024,ToolACE: Winning the points of LLM function calling,2024,arXiv preprint,needs_metadata,L0_seeded,,,,,,,,survey_background,unknown,unknown,Official source is linked; detailed reasoning-data summary is still pending.,"Verified citation waypoint; add a paper-specific data-object, verifier, and audit note before promoting it as a core read."
toolllm-facilitating-large-language-models-to-master-16000-real-world-apis-2024,ToolLLM: Facilitating large language models to master 16000+ real-world APIs,2023,ICLR,verified,L4_carded,https://arxiv.org/abs/2307.16789,https://arxiv.org/abs/2307.16789,https://arxiv.org/abs/2307.16789,,,,,data_release;benchmark;agent_environment,environmental;programmatic,sft;agent_training;evaluation,Tool-use data and ToolBench-style evaluation show how API calls become the reasoning trace and how tool responses anchor feedback.,Tool-use data and ToolBench-style evaluation show how API calls become the reasoning trace and how tool responses anchor feedback.
toolsandbox-a-stateful-conversational-interactive-evaluation-benchmark-for-tool--2024,"ToolSandbox: A stateful, conversational, interactive evaluation benchmark for tool use",2024,arXiv preprint,needs_metadata,L0_seeded,,,,,,,,survey_background,unknown,unknown,Official source is linked; detailed reasoning-data summary is still pending.,"Verified citation waypoint; add a paper-specific data-object, verifier, and audit note before promoting it as a core read."
tulu-3-pushing-frontiers-in-open-language-model-post-training-2024,Tulu 3: Pushing frontiers in open language model post-training,2024,arXiv,verified,L5_audit_ready,https://arxiv.org/abs/2411.15124,https://arxiv.org/abs/2411.15124,https://arxiv.org/abs/2411.15124,https://github.com/allenai/open-instruct,https://huggingface.co/collections/allenai/tulu-3-datasets,https://huggingface.co/collections/allenai/tulu-3-datasets,https://allenai.org/blog/tulu-3-technical,model_report;construction_recipe;data_release,mixed;programmatic;judgment_required,sft;preference_learning;rlvr;evaluation,"Tulu 3 releases an open post-training stack with SFT data, preference data, RLVR recipes, code, models, and evaluation guidance.","It is one of the clearest open references for modern post-training pipelines because it exposes data mixtures, objectives, decontamination, evaluation, and training infrastructure together."
visualwebarena-evaluating-multimodal-agents-on-realistic-visual-web-tasks-2024,VisualWebArena: Evaluating multimodal agents on realistic visual web tasks,2024,arXiv preprint,partial,L0_seeded,,,,,,,,benchmark;agent_environment,environmental,evaluation;agent_training,"Extends WebArena-style evaluation toward visual web interaction, useful when reasoning data includes screenshots and UI state.","Extends WebArena-style evaluation toward visual web interaction, useful when reasoning data includes screenshots and UI state."
weblinx-real-world-website-navigation-with-multi-turn-dialogue-2024,WebLINX: Real-world website navigation with multi-turn dialogue,2024,arXiv preprint,needs_metadata,L0_seeded,,,,,,,,survey_background,unknown,unknown,Official source is linked; detailed reasoning-data summary is still pending.,"Verified citation waypoint; add a paper-specific data-object, verifier, and audit note before promoting it as a core read."
wildguard-2024,WildGuard,2024,NeurIPS,needs_metadata,L0_seeded,,,,,,,,survey_background,unknown,unknown,Official source is linked; detailed reasoning-data summary is still pending.,"Verified citation waypoint; add a paper-specific data-object, verifier, and audit note before promoting it as a core read."
workarena-how-capable-are-web-agents-at-solving-common-knowledge-work-tasks-2024,WorkArena: How capable are web agents at solving common knowledge work tasks?,2024,unknown,needs_metadata,L0_seeded,,,,,,,,survey_background,unknown,unknown,Official source is linked; detailed reasoning-data summary is still pending.,"Verified citation waypoint; add a paper-specific data-object, verifier, and audit note before promoting it as a core read."
xstest-2024,XSTest,2024,NAACL,needs_metadata,L0_seeded,,,,,,,,survey_background,unknown,unknown,Official source is linked; detailed reasoning-data summary is still pending.,"Verified citation waypoint; add a paper-specific data-object, verifier, and audit note before promoting it as a core read."
1-4-million-open-source-distilled-reasoning-dataset-to-empower-large-language-mo-2025,1.4 Million Open-Source Distilled Reasoning Dataset to Empower Large Language Model Training (AM-DeepSeek-R1-Distilled),2025,arXiv preprint arXiv:2503.19633,verified,L1_link_verified,https://arxiv.org/abs/2503.19633,https://arxiv.org/abs/2503.19633,https://arxiv.org/abs/2503.19633,,,,,survey_background,unknown,unknown,Official source is linked; detailed reasoning-data summary is still pending.,"Verified citation waypoint; add a paper-specific data-object, verifier, and audit note before promoting it as a core read."
1-shot-rlvr-learning-reasoning-with-minimal-verifiable-data-2025,1-shot RLVR: Learning reasoning with minimal verifiable data,2025,arXiv preprint,needs_metadata,L0_seeded,,,,,,,,survey_background,unknown,unknown,Official source is linked; detailed reasoning-data summary is still pending.,"Verified citation waypoint; add a paper-specific data-object, verifier, and audit note before promoting it as a core read."
a-sober-look-at-progress-in-language-model-reasoning-pitfalls-and-paths-to-repro-2025,A Sober Look at Progress in Language Model Reasoning: Pitfalls and Paths to Reproducibility,2025,Conference on Language Modeling (COLM),verified,L5_audit_ready,https://arxiv.org/abs/2504.07086,https://arxiv.org/abs/2504.07086,https://arxiv.org/abs/2504.07086,,,,,survey_background,unknown,unknown,"Audits reasoning-model progress claims by showing that benchmark results can be highly sensitive to decoding, seeds, prompt format, and environment details.","It is an audit anchor for this atlas: reasoning-data claims need reproducible evaluation settings, not just headline benchmark gains."
a-survey-on-llm-mid-training-2025,A Survey on LLM Mid-Training,2025,arXiv preprint arXiv:2510.23081,verified,L1_link_verified,https://arxiv.org/abs/2510.23081,https://arxiv.org/abs/2510.23081,https://arxiv.org/abs/2510.23081,,,,,survey_background,unknown,unknown,Official source is linked; detailed reasoning-data summary is still pending.,"Verified citation waypoint; add a paper-specific data-object, verifier, and audit note before promoting it as a core read."
absolute-zero-reinforced-self-play-reasoning-with-zero-data-2025,Absolute Zero: Reinforced Self-play Reasoning with Zero Data,2025,arXiv preprint arXiv:2505.03335,verified,L4_carded,https://arxiv.org/abs/2505.03335,https://arxiv.org/abs/2505.03335,https://arxiv.org/abs/2505.03335,,,,,construction_recipe;scaling_study,programmatic,rlvr;evaluation,"Self-play RLVR recipe where the model proposes and solves tasks without external training data, using verifiable feedback to ground the loop.","Self-play RLVR recipe where the model proposes and solves tasks without external training data, using verifiable feedback to ground the loop."
abstentionbench-2025,AbstentionBench,2025,arXiv,verified,L5_audit_ready,https://arxiv.org/abs/2506.09038,https://arxiv.org/abs/2506.09038,https://arxiv.org/abs/2506.09038,https://github.com/facebookresearch/AbstentionBench,https://huggingface.co/datasets/facebook/AbstentionBench,https://huggingface.co/datasets/facebook/AbstentionBench,,benchmark;audit_failure,judgment_required;mixed,evaluation;safety_alignment,"AbstentionBench evaluates whether LLMs know when not to answer across unknown, underspecified, false-premise, subjective, and stale-information questions.",It is a direct audit surface for reasoning models: stronger reasoning can still fail if the model confidently answers unanswerable questions instead of abstaining.
abstentionbench-reasoning-llms-fail-on-unanswerable-questions-2025,AbstentionBench: Reasoning LLMs Fail on Unanswerable Questions,2025,arXiv preprint arXiv:2506.09038,verified,L1_link_verified,https://arxiv.org/abs/2506.09038,https://arxiv.org/abs/2506.09038,https://arxiv.org/abs/2506.09038,,,,,survey_background,unknown,unknown,Official source is linked; detailed reasoning-data summary is still pending.,"Verified citation waypoint; add a paper-specific data-object, verifier, and audit note before promoting it as a core read."
acord-attorney-curated-open-research-dataset-2025,ACORD: Attorney-curated open research dataset,2025,unknown,needs_metadata,L0_seeded,,,,,,,,survey_background,unknown,unknown,Official source is linked; detailed reasoning-data summary is still pending.,"Verified citation waypoint; add a paper-specific data-object, verifier, and audit note before promoting it as a core read."
aegis2-0-a-diverse-ai-safety-dataset-and-risks-taxonomy-for-alignment-of-llm-gua-2025,Aegis2.0: A Diverse AI Safety Dataset and Risks Taxonomy for Alignment of LLM Guardrails,2025,arXiv preprint arXiv:2501.09004,verified,L1_link_verified,https://arxiv.org/abs/2501.09004,https://arxiv.org/abs/2501.09004,https://arxiv.org/abs/2501.09004,,,,,survey_background,unknown,unknown,Official source is linked; detailed reasoning-data summary is still pending.,"Verified citation waypoint; add a paper-specific data-object, verifier, and audit note before promoting it as a core read."
aegis2-2025,Aegis2.0,2025,arXiv,verified,L5_audit_ready,https://arxiv.org/abs/2501.09004,https://arxiv.org/abs/2501.09004,https://arxiv.org/abs/2501.09004,,https://huggingface.co/datasets/nvidia/Aegis-AI-Content-Safety-Dataset-2.0,https://huggingface.co/datasets/nvidia/Aegis-AI-Content-Safety-Dataset-2.0,,data_release;benchmark;verifier_reward,judgment_required;mixed,safety_alignment;evaluation;reward_modeling,Aegis2.0 releases a human-annotated AI-safety dataset and risk taxonomy for training and evaluating LLM guardrails.,"It is useful for reasoning-data readers because safety alignment often depends on rubric-like hazard labels, response-pair judgments, and guard-model training data rather than exact-answer verification."
